{
  "name": "A stream that closes cleanly ends with closed and throws nothing into the caller's loop",
  "call": {
    "operation": "stream_live_events",
    "mode": "stream",
    "path": {
      "projectId": "9f1c2b3a-0000-4000-8000-000000000003"
    }
  },
  "exchange": [
    {
      "expect": {
        "method": "GET",
        "path": "/v1/projects/9f1c2b3a-0000-4000-8000-000000000003/live-events",
        "headers": {
          "Accept": "text/event-stream"
        }
      },
      "respond": {
        "status": 200,
        "headers": {
          "Content-Type": "text/event-stream"
        },
        "frames": [
          ": keep-alive\n\n"
        ]
      }
    }
  ],
  "expectOutcome": {
    "items": [],
    "end": "closed"
  }
}
