{
  "name": "maxAttempts 1 disables retry: the first 429 surfaces and nothing waits",
  "client": {
    "retry": {
      "maxAttempts": 1
    }
  },
  "call": {
    "operation": "get_charger",
    "path": {
      "chargingStationId": "9f1c2b3a-0000-4000-8000-000000000001"
    }
  },
  "exchange": [
    {
      "expect": {
        "method": "GET",
        "path": "/v1/charging-stations/9f1c2b3a-0000-4000-8000-000000000001"
      },
      "respond": {
        "status": 429,
        "headers": {
          "Retry-After": "2"
        },
        "body": {
          "error": "rateLimited",
          "message": "slow down"
        }
      }
    }
  ],
  "expectOutcome": {
    "error": {
      "kind": "rateLimited",
      "status": 429,
      "retryAfterSeconds": 2
    }
  },
  "expectWaitsSeconds": []
}
